6:21 7 marzo 2022;El histórico contraataque de Occidente a Putin, el "agitador del orden internacional"
1:09 7 marzo 2022;Shell defiende su "difícil" decisión de seguir comprando petróleo de Rusia
23:28 6 marzo 2022;Zelensky insta a los ucranianos a pasar a la ofensiva y arremete contra la OTAN por no cerrar el espacio aéreo
20:58 6 marzo 2022;Cómo la "humillación" rusa por la desintegración de la URSS ayuda a explicar las ambiciones expansionistas de Putin
18:07 6 marzo 2022;Quién era Molotov y por qué da nombre a los artefactos explosivos que los ucranianos están usando contra la invasión rusa
14:15 6 marzo 2022;Entre la esperanza y la desesperación: suspenden un nuevo intento para evacuar a miles de civiles de Mariúpol
12:54 6 marzo 2022;Los rusos que abandonan su país hacia Finlandia
12:40 6 marzo 2022;Las imágenes que revelan la destrucción que deja la guerra en Ucrania
8:16 6 marzo 2022;Putin dice que las sanciones impuestas por Occidente a Rusia son "como una declaración de guerra"
7:11 6 marzo 2022;Así acabaron otras incursiones militares ordenadas por Putin (y cómo se comparan con el conflicto con Ucrania)
23:49 5 marzo 2022;Rusia y Ucrania se acusan de no respetar el alto al fuego y suspenden la evacuación de Mariúpol
23:38 5 marzo 2022;Mastercard y Visa suspenden operaciones en Rusia
19:36 5 marzo 2022;El espectáculo sexual submarino más extravagante de la naturaleza
15:31 5 marzo 2022;"La vida se está desmoronando": el impacto de boicots y cancelaciones sobre la población rusa por la invasión a Ucrania
15:31 5 marzo 2022;"La vida se está desmoronando": el impacto de boicots y cancelaciones sobre la población rusa por la invasión a Ucrania
13:55 5 marzo 2022;El creciente número de empresas occidentales que se está retirando de Rusia (y las que aún permanecen en el país)
10:44 5 marzo 2022;Por qué Jersón, Mariúpol y Odesa son clave para el éxito de la invasión rusa de Ucrania
5:41 5 marzo 2022;Qué es el "Russkiy Mir" ("Mundo Ruso") al que Putin quiere unificar
2:06 5 marzo 2022;Qué otras centrales nucleares hay en Ucrania y qué riesgos existen si son atacadas como Zaporiyia
1:15 5 marzo 2022;Zelensky: "El ataque a la planta nuclear de Zaporiyia pudo haber sido como seis Chernóbil"
0:41 5 marzo 2022;Rusia bloquea Facebook y aprueba hasta 15 años de cárcel por "noticias falsas" sobre su ejército
19:06 4 marzo 2022;La BBC resucita las emisiones de onda corta en Ucrania y Rusia que se usaban durante la Guerra Fría
18:22 4 marzo 2022;Rusia toma en Ucrania el control de la central nuclear de Zaporiyia, la más grande de Europa
17:58 4 marzo 2022;El antes y el después de la destrucción causada por las fuerzas rusas en Ucrania tras una semana de invasión
17:07 4 marzo 2022;"Mi ciudad en Ucrania está siendo bombardeada, pero mi madre en Rusia no me cree"
16:00 4 marzo 2022;¿Qué puede pasar si Rusia logra apoderarse de Ucrania? y otras 7 preguntas de los lectores a los periodistas de la BBC en la zona de conflicto
15:52 4 marzo 2022;Las fuerzas rusas toman el control de la planta nuclear más grande de Europa en el sur de Ucrania tras un incendio
15:29 4 marzo 2022;Cuán peligroso fue el ataque a la planta nuclear de Zaporiyia y qué busca Rusia con su toma
12:50 4 marzo 2022;5 escenarios de cómo podría terminar la guerra entre Rusia y Ucrania
10:29 4 marzo 2022;Criptoguerra: cómo Occidente quiere evitar que los oligarcas y otros ciudadanos rusos utilicen las criptomonedas para evadir las sanciones
1:20 4 marzo 2022;1 millón de personas huyen de Ucrania en medio de la crisis humanitaria desatada por la invasión de Rusia
0:42 4 marzo 2022;Las razones por las que el convoy ruso tiene "poco progreso" en su camino hacia Kiev
0:41 4 marzo 2022;Rusia y Ucrania alcanzan un principio de acuerdo para crear corredores humanitarios y evacuar a la población civil
19:58 3 marzo 2022;"Estamos aterrorizados": el asedio de las tropas rusas a la ciudad portuaria de Mariúpol
18:11 3 marzo 2022;Los gobiernos de Francia y Alemania incautan yates de oligarcas rusos
17:23 3 marzo 2022;Quién pertenece al círculo íntimo de Putin que dirige la invasión rusa en Ucrania
14:26 3 marzo 2022;6 momentos clave de la primera semana de invasión de Rusia a Ucrania
13:57 3 marzo 2022;"Estaré al lado de mi marido y con ustedes": quién es Olena Zelenska, la primera dama de Ucrania
13:36 3 marzo 2022;Rusia toma el control de la ciudad clave de Jersón mientras intensifica los ataques sobre Járkiv y Mariúpol
11:51 3 marzo 2022;Cómo saber si lo que estás viendo sobre el conflicto en Ucrania es real o son "fake news"
11:27 3 marzo 2022;"Insto a todos a salir a las calles y luchar por la paz": la oposición dentro de Rusia a la invasión de Putin a Ucrania
10:33 3 marzo 2022;"Europa le está financiando los caprichos a Putin"
5:10 3 marzo 2022;El dilema de Israel ante el conflicto entre Rusia y Ucrania
3:56 3 marzo 2022;La indignación en Ucrania por el ataque cercano a Babi Yar, el memorial a las víctimas de una masacre nazi en Kiev
23:47 2 marzo 2022;Cuál es la estrategia militar de Rusia en Ucrania y qué lecciones aprendió tras la caída de la URSS y la guerra de Georgia
20:34 2 marzo 2022;El multimillonario ruso Roman Abramovich anuncia que pondrá a la venta el club inglés Chelsea
19:25 2 marzo 2022;Cuán real es el riesgo nuclear del conflicto en Ucrania
18:56 2 marzo 2022;Rusia lanza un asalto aéreo sobre Járkiv, estrecha el cerco sobre Kiev y reivindica el control de Jersón
17:46 2 marzo 2022;La Asamblea General de la ONU aprueba una resolución de condena a la invasión rusa de Ucrania
15:48 2 marzo 2022;El hospital de niños en Kiev que lucha por sobrevivir
15:23 2 marzo 2022;"Quien sea que necesite ayuda la tendrá": los polacos que se acercan a la frontera para llevarse refugiados ucranianos a sus casas
13:38 2 marzo 2022;Cómo la Convención de Montreux frenó el paso de buques de guerra rusos por el Bósforo
11:52 2 marzo 2022;"Estamos usando armas económicas para detener una guerra real": cuál puede ser el impacto de las sanciones financieras contra Rusia
11:02 2 marzo 2022;"Durante décadas ha habido advertencias de la provocación que es para Rusia la expansión de la OTAN"
7:29 2 marzo 2022;"No tiene idea de lo que viene": cómo Biden lanzó la mayor advertencia de un líder de EE.UU. a uno de Rusia desde el fin de la Guerra Fría
6:10 2 marzo 2022;"Putin pensó que podía dividirnos, pero se equivocó": el mensaje de Biden a Putin en su primer Estado de la Unión
2:20 2 marzo 2022;4 claves para entender las sanciones sin precedentes impuestas por Occidente a Rusia
0:09 2 marzo 2022;Las numerosas muestras de solidaridad para acoger a los ucranianos que huyen de la invasión rusa
23:56 1 marzo 2022;El error de cálculo de Putin que podría llevarlo a golpear más duro a Ucrania
22:15 1 marzo 2022;"Parece una realidad paralela": cómo los medios rusos están informando de la invasión de Putin a Ucrania
19:14 1 marzo 2022;Las imágenes del ataque a la Plaza de la Libertad de la ciudad ucraniana de Járkiv
18:39 1 marzo 2022;Más de 100 diplomáticos boicotean un discurso del canciller ruso Serguéi Lavrov ante la ONU y abandonan la sala
17:55 1 marzo 2022;El verdadero poderío nuclear de Rusia (y cómo se compara con el de otros países)
16:35 1 marzo 2022;"Solo ucranianos. Me dijeron que siendo negra debía caminar": las denuncias de discriminación hacia estudiantes africanos e indios que huyen de Ucrania
