15:27 27 marzo 2022;La extraordinaria belleza de Pilbara, el sitio de Australia con algunas de las formaciones más antiguas de la Tierra
10:33 27 marzo 2022;Cómo operaba la "Checa", la cruel policía secreta bolchevique responsable de instaurar el "Terror Rojo" en Rusia
5:19 27 marzo 2022;Cómo se forma la identidad nacional y por qué algunos países son mucho más patrióticos que otros
0:28 27 marzo 2022;Muere en Colombia el baterista de la banda Foo Fighters
21:37 26 marzo 2022;Putin "no puede permanecer en el poder", dice Biden en un mensaje dirigido a los rusos desde Polonia
17:11 26 marzo 2022;Ucrania asegura haber matado al general ruso que dijo que la invasión terminaría en horas
15:19 26 marzo 2022;La OMS denuncia que están aumentando los ataques contra hospitales en Ucrania
12:54 26 marzo 2022;50 años de la visita de Nixon a China: la historia detrás de la "semana que cambió el mundo"
12:17 26 marzo 2022;9 cosas que debes saber para seguir la ceremonia de los Oscar este domingo
10:31 26 marzo 2022;Pedro el Grande, el poderoso zar que creó la Rusia moderna (y por qué es tan admirado por Vladimir Putin)
5:23 26 marzo 2022;“Podemos estar en las primeras etapas de lo que los historiadores dirán que fue el inicio de la Tercera Guerra Mundial”
2:08 26 marzo 2022;El extraño video al estilo Hollywood que transmitió Corea del Norte sobre un nuevo lanzamiento de un misil
0:55 26 marzo 2022;Rusia da por concluida la primera fase de la invasión de Ucrania y "rebaja" sus objetivos militares
0:49 26 marzo 2022;“Tememos por nuestra vida, no por las acusaciones": entrevista exclusiva a Ana García Carías, esposa del expresidente de Honduras Juan Orlando Hernández
22:41 25 marzo 2022;La escritora JK Rowling responde a los comentarios de Putin sobre ella y la cultura de la cancelación
21:47 25 marzo 2022;El sacerdote ucraniano desarmado a quien dispararon en un puesto de control
19:39 25 marzo 2022;Las controversiales imágenes del príncipe William y su esposa en Jamaica que reflejan "cómo el mundo ha cambiado"
17:35 25 marzo 2022;"Solo había visto esto en películas de la Segunda Guerra Mundial": cómo es dormir en un refugio subterráneo en Kiev
16:50 25 marzo 2022;Reino Unido: aumentan en 1 millón los casos de coronavirus en una semana
16:37 25 marzo 2022;3 razones que explican el éxito de la canción "We don’t talk about Bruno" de la película "Encanto"
15:47 25 marzo 2022;"Cerca de 300 personas" murieron en el ataque al teatro de Mariúpol
14:49 25 marzo 2022;La artista rusa de 76 años que desafía a Putin
14:13 25 marzo 2022;4 claves que explican qué está haciendo bien Ucrania para contener el poderío ruso
13:17 25 marzo 2022;Las detenciones y secuestros de civiles ucranianos en las zonas controladas por los rusos
12:57 25 marzo 2022;EE.UU. y Europa firman un acuerdo para limitar la dependencia energética de Rusia
10:41 25 marzo 2022;Cuáles son las películas favoritas para ganar el Oscar y cuáles pueden dar la sorpresa (según 4 críticos consultados por BBC Mundo)
9:09 25 marzo 2022;Cuál es la influencia del neonazismo y la extrema derecha en Ucrania y Rusia
5:35 25 marzo 2022;El dilema de Turquía: miembro de la OTAN y amigo de Putin (y cómo la guerra ha puesto en peligro la relación entre Ankara y Moscú)
23:31 24 marzo 2022;Qué hay detrás de la ambigüedad de México sobre la invasión de Rusia a Ucrania
19:40 24 marzo 2022;Estados Unidos anuncia que recibirá 100.000 refugiados ucranianos
19:04 24 marzo 2022;¿Quiénes son las únicas 4 mujeres entre los 30 líderes que participan en la cumbre de la OTAN?
14:45 24 marzo 2022;Corea del Norte: por primera vez en 5 años, Pyonyang prueba un misil intercontinental prohibido
14:26 24 marzo 2022;Las islas privadas de Jeffrey Epstein en el Caribe salen a la venta por US$125 millones
14:16 24 marzo 2022;La ciudad inglesa que se convirtió en refugio para hongkoneses que huyen de China
13:31 24 marzo 2022;Ucrania asegura haber destruido un barco de guerra ruso en el ocupado puerto de Berdyansk
12:24 24 marzo 2022;"El mundo debe detener la guerra": Zelensky llama a protestar en las calles a un mes del inicio de la invasión a Ucrania
10:45 24 marzo 2022;Los 3 ciberataques rusos que más teme Occidente
9:09 24 marzo 2022;Un mes de la guerra en Ucrania: “Toda la vida normal ha desaparecido”
5:02 24 marzo 2022;Cómo una de las ciudades más pobres de Reino Unido se convirtió en un refugio para hongkoneses que huyeron de China
4:22 24 marzo 2022;Detienen en la frontera de Ucrania al sospechoso de matar al exjugador de rugby argentino Federico Martín Aramburú
3:09 24 marzo 2022;Las lágrimas de las jóvenes afganas por el repentino cambio de los talibanes sobre las escuelas secundarias
1:52 24 marzo 2022;Muere en un bombardeo en Kiev la periodista rusa Oksana Baulina
22:54 23 marzo 2022;Cómo sobreviví al ataque de una bomba de 500kg contra el teatro de Mariúpol
20:06 23 marzo 2022;Muere Madeleine Albright, primera secretaria de Estado de la historia de EE.UU.
13:12 23 marzo 2022;La pequeña ciudad ucraniana que logró detener los planes militares de Rusia
12:20 23 marzo 2022;5 claves para entender el conflicto olvidado del Sahara
12:11 23 marzo 2022;Oscar 2022: ¿siguen siendo relevantes los premios del cine de Hollywood?
11:49 23 marzo 2022;Ashleigh Barty: qué llevó a la tenista número 1 del mundo a anunciar su retirada con tan solo 25 años
11:44 23 marzo 2022;El tratamiento en el que se usó la vacuna para curar la covid y no para prevenirla
10:43 23 marzo 2022;El solitario funeral de un joven soldado ucraniano
23:57 22 marzo 2022;"Nos sentimos impotentes al estar tan lejos de nuestro país": los científicos de Ucrania varados en la Antártida
17:28 22 marzo 2022;Mueren 4 personas en un ataque en un centro comercial en Israel
14:57 22 marzo 2022;Alexei Navalny: condenan al líder opositor ruso a 9 años más de cárcel en un juicio tildado de "farsa"
14:45 22 marzo 2022;"Es un Mariel silencioso": los miles de cubanos que usan Nicaragua como ruta para llegar a EE.UU.
14:00 22 marzo 2022;Lo que se sabe del accidente del avión de China Eastern que se estrelló con 132 personas a bordo
13:46 22 marzo 2022;Residente sobre EE.UU. y su canción"This is Not America": "Te molesta sentir que se llevan un nombre que le pertenece a todo un continente"
11:56 22 marzo 2022;El gigantesco costo económico que debe pagar Rusia para financiar la guerra
10:59 22 marzo 2022;Los niños heridos por los bombardeos en Mariúpol, la ciudad ucraniana sitiada por las fuerzas rusas
10:47 22 marzo 2022;4 razones por las que la ciudad ucraniana de Mariúpol es tan importante para Rusia
9:04 22 marzo 2022;“Nunca imaginamos ser padres de trillizas”: la singular historia de una pareja gay española que adoptó a tres hermanas recién nacidas
5:35 22 marzo 2022;¿Qué es lo que mueve a Putin? Los agentes occidentales que tratan de entender lo que pasa por la cabeza del líder ruso
2:32 22 marzo 2022;Estos son los nominados a los Oscar de Hollywood (¿cuáles son de América Latina?)
1:36 22 marzo 2022;El sobreviviente del Holocausto que murió en un bombardeo de las fuerzas rusas en Járkiv
23:21 21 marzo 2022;El nuevo auge de los “teléfonos tontos” en un mundo hiperconectado
22:23 21 marzo 2022;"EE.UU. ha adoctrinado a mucha gente para que crean que es América": hablamos con Residente de su impactante tema "This is not America"
20:11 21 marzo 2022;Las imágenes de dron que muestran la destrucción que ha dejado el asedio ruso en Mariúpol
18:02 21 marzo 2022;Qué son los misiles hipersónicos y por qué su uso por parte de Rusia en Ucrania "es una señal" de Moscú para Occidente
15:08 21 marzo 2022;Ómicron vs. cero covid: cuánto puede aguantar China con su estrategia de no vivir con covid
12:51 21 marzo 2022;"Se suponía que no debía enterrar a mis hijos": las desgarradoras historias que deja el bombardeo en Mariúpol
12:30 21 marzo 2022;Rusia y Ucrania: ¿funcionan las sanciones económicas? Lo que dice la historia sobre el éxito de estas medidas
6:55 21 marzo 2022;Ucrania rechaza el ultimátum de Rusia para la rendición de Mariúpol, la estratégica ciudad sitiada por las fuerzas rusas
4:40 21 marzo 2022;"Londongrado": cómo Londres se convirtió en el principal destino de los millones de los oligarcas rusos
21:44 20 marzo 2022;"Putin ha rediseñado el mundo, pero no de la manera que él quería"
16:43 20 marzo 2022;Muere en un tiroteo en París el exjugador de rugby argentino Federico Martín Aramburú
13:53 20 marzo 2022;La furia que desató Boris Johnson al comparar el Brexit con la invasión de Rusia a Ucrania
12:14 20 marzo 2022;Ucrania denuncia el bombardeo ruso de una escuela donde se refugiaban 400 personas
10:30 20 marzo 2022;Las dudas sobre Neom, el "gigaproyecto ecológico" que Arabia Saudita planea construir en medio del desierto
9:25 20 marzo 2022;"Por qué usar hiyab no significa que las musulmanas estemos oprimidas"
23:43 19 marzo 2022;Rusia niega que los cosmonautas de la Estación Espacial Internacional se vistieran con los colores de la bandera de Ucrania
18:55 19 marzo 2022;Combates en las calles de Mariúpol dificultan el rescate de centenares de civiles atrapados en las ruinas del teatro de la ciudad, devastada por los ataques de Rusia
12:47 19 marzo 2022;Qué es "tan ping", el movimiento social nacido de la pandemia en China y por qué preocupa al presidente Xi Jinping
11:16 19 marzo 2022;Zelensky pide conversaciones "significativas" de paz con Moscú "sin demora"
10:36 19 marzo 2022;Armas, sobornos y una deuda multimillonaria: el origen de los más de US$500 millones que Reino Unido pagó a Irán después de 43 años
9:31 19 marzo 2022;Por qué Rusia no ha logrado controlar los cielos de Ucrania en 3 semanas de guerra (pese a tener una de las fuerzas aéreas más grandes del mundo)
5:00 19 marzo 2022;La guerra de Invierno: la lucha desesperada que libró Finlandia para sobrevivir frente al poderío de la Unión Soviética
23:10 18 marzo 2022;Putin se da un baño de masas en un estadio de Moscú y asegura que cumplirán con sus planes en Ucrania
22:41 18 marzo 2022;Qué armas entregará Estados Unidos a Ucrania y cuán decisivas serán en la guerra
22:11 18 marzo 2022;El duelo de los rusos que entierran a sus soldados caídos en Ucrania sin cuestionar las acciones de su gobierno
22:11 18 marzo 2022;El duelo de los rusos que entierran a sus soldados caídos en Ucrania sin cuestionar las acciones de su gobierno
18:09 18 marzo 2022;Qué pasó en Crimea en 2014 y por qué es importante ahora
17:56 18 marzo 2022;El mensaje viral de Arnold Schwarzenegger para Putin y la población rusa por la invasión de Ucrania
16:30 18 marzo 2022;Qué son las armas nucleares "tácticas" (y cuántas tiene Rusia)
12:59 18 marzo 2022;Violencia sexual, trata de personas y partos en condiciones deplorables: los riesgos extremos que enfrentan las mujeres en Ucrania
12:37 18 marzo 2022;Mi pareja no me dejaba tomar la pastilla anticonceptiva
12:26 18 marzo 2022;Entrevista BBC | "Los rusos están 'zombificados' por la propaganda": Marina Ovsyannikova, la periodista rusa que desafió al Kremlin en televisión
10:16 18 marzo 2022;"¡Salta al cráter si hay más bombardeos!": el corresponsal de la BBC en el frente de batalla en la última línea de defensa de Járkiv
2:34 18 marzo 2022;Las demandas que Putin puso sobre la mesa para detener la invasión de Ucrania en una llamada con el presidente de Turquía
0:36 18 marzo 2022;Rusia alarga la detención de estrella de baloncesto estadounidense arrestada hace un mes en Moscú
22:49 17 marzo 2022;Los residentes de Jersón desafían con protestas el dominio ruso sobre la ciudad ucraniana
18:11 17 marzo 2022;La "guerra olvidada" de Yemen: 8 años de conflicto y 700 ataques aéreos en un mes
15:19 17 marzo 2022;Anonymous: "Intensificaremos los ataques contra el Kremlin"
13:22 17 marzo 2022;La cadena de renuncias de periodistas de medios rusos en protesta por la guerra
12:19 17 marzo 2022;Biden desata la furia del Kremlin al llamar a Putin "criminal de guerra": ¿puede el presidente ruso ser procesado por sus acciones en Ucrania?
12:04 17 marzo 2022;Cuál es el sistema económico de Rusia y por qué se le acusa de ser un "capitalismo de compinches"
9:21 17 marzo 2022;Acusan a Rusia de atacar un teatro en Mariúpol en el que se refugiaban más de 1.000 civiles
3:47 17 marzo 2022;Un juez de la Corte Suprema de Honduras autoriza la extradición del expresidente Juan Orlando Hernández a Estados Unidos
3:44 17 marzo 2022;Cómo Alemania está deshaciendo décadas de estrechos lazos con Rusia a raíz de la invasión de Ucrania
2:38 17 marzo 2022;Terremoto en Japón: un sismo de magnitud 7,4 en Fukushima deja al menos dos muertos y decenas de heridos
2:36 17 marzo 2022;Liberan a Nazanin Zaghari-Ratcliffe, la británica que estuvo 6 años detenida en Irán acusada de planear derrocar al gobierno
0:12 17 marzo 2022;El amenazante mensaje de Putin contra la "escoria y los traidores" entre los rusos que se alinean con Occidente
22:26 16 marzo 2022;"He pasado semanas llorando de frustración": la precaria situación de los maestros en Puerto Rico, los peores pagados en EE.UU.
18:52 16 marzo 2022;"Estamos viviendo un 11 de septiembre todos los días": el emotivo discurso del presidente de Ucrania ante el Congreso de EE.UU.
18:32 16 marzo 2022;La Fed sube la tasa de interés 0,25 puntos en EE.UU.: por qué importa y cómo puede afectar a América Latina
17:57 16 marzo 2022;La desesperada situación en Mariúpol: 400 "rehenes" en un hospital mientras el hambre y las infecciones se extienden en los refugios
14:15 16 marzo 2022;Qué tiene que conseguir Putin para poner fin a la invasión en Ucrania
13:14 16 marzo 2022;Las empresas occidentales que no pueden salir de Rusia
13:03 16 marzo 2022;La polémica ley de Putin para no devolver a Occidente más de 500 aeronaves comerciales valoradas en más de US$10.000 millones
11:29 16 marzo 2022;"Entre la esclavitud y la libertad": las mujeres que se quedan a luchar en Ucrania
2:33 16 marzo 2022;La arriesgada visita de tres primeros ministros europeos a Kiev en medio de los bombardeos rusos en Ucrania
1:36 16 marzo 2022;Quiénes son los periodistas ucranianos y extranjeros que han muerto desde que empezó la invasión rusa
20:18 15 marzo 2022;Por qué Kiev no caerá tan fácilmente bajo control de las fuerzas rusas, según los generales responsables de su defensa
19:09 15 marzo 2022;"Fui interrogada por más de 14 horas": Marina Ovsyannikova, la mujer que protestó contra la guerra en uno de los canales de TV más populares de Rusia
18:20 15 marzo 2022;Cómo es la relación económica entre Rusia y China (y por qué es clave en la guerra en Ucrania)
18:09 15 marzo 2022;"Ella está atrapada en una zona de conflicto sin poder salir": el limbo de las familias estadounidenses que adoptaron a niños ucranianos
17:06 15 marzo 2022;Rusia sanciona a Joe Biden, a varios funcionarios estadounidenses y a Justin Trudeau
14:20 15 marzo 2022;Coronavirus: China vuelve a los confinamientos "como hace dos años" y pone en cuarentena a más de 36 millones de personas
12:44 15 marzo 2022;"Es un momento difícil y peligroso": los bombardeos sobre Kiev se intensifican con ataques a edificios residenciales
12:07 15 marzo 2022;Qué efectos puede tener la guerra en Ucrania en las economías de América Latina
10:41 15 marzo 2022;"Todos nos miran y dicen 'bravo', pero necesitamos que nos digan qué hacer con los refugiados": las dificultades en Polonia tras la llegada masiva de ucranianos
7:21 15 marzo 2022;Estados Unidos advierte a China que no apoye a Rusia tras la invasión de Ucrania
4:01 15 marzo 2022;Más allá de Rusia y Ucrania: 6 conflictos armados que están ocurriendo en el mundo
2:44 15 marzo 2022;"No crean en la propaganda": una mujer interrumpe un noticiero en la televisión rusa con un cartel en contra de la guerra en Ucrania
2:15 15 marzo 2022;La nueva evidencia que revela los negocios corruptos del oligarca ruso Roman Abramovich
22:28 14 marzo 2022;Anna Delvey: ¿qué ha pasado con su caso legal y cómo ha recibido el éxito de la serie desde la prisión?
21:43 14 marzo 2022;Las fosas comunes improvisadas en las ciudades ucranianas bombardeadas por las fuerzas rusas
19:33 14 marzo 2022;Muere la mujer embarazada que fue fotografiada en una camilla tras el bombardeo al hospital materno en Mariúpol
18:59 14 marzo 2022;Cómo Hong Kong pasó de ser un modelo en la lucha contra la covid a tener la tasa de mortalidad más alta del mundo desarrollado
14:44 14 marzo 2022;Los inclementes bombardeos rusos contra Zhitómir, la ciudad que es un corredor clave hacia Kiev
12:19 14 marzo 2022;¿Puede la invasión rusa en Ucrania ayudar a descongelar las relaciones entre Estados Unidos y Venezuela?
11:25 14 marzo 2022;Los complejos escenarios para una solución negociada a la guerra de Ucrania
10:26 14 marzo 2022;Por qué Rusia nunca entró en la OTAN
5:16 14 marzo 2022;Qué tan estrecha es la relación económica entre Rusia y China (y por qué es clave en tiempos de guerra)
4:50 14 marzo 2022;Qué se sabe de la estratégica base militar ucraniana cerca de Polonia que fue atacada por Rusia
1:35 14 marzo 2022;Bafta 2022: estos son los ganadores de los premios británicos de cine antesala de los Oscar
23:13 13 marzo 2022;Muere William Hurt, ganador del Oscar por "El beso de la mujer araña" y uno de los actores míticos del Hollywood de los 80
19:06 13 marzo 2022;"Mi mamá me dijo que me quedara en el refugio": los adolescentes que luchan en Ucrania con solo tres días de entrenamiento
18:48 13 marzo 2022;Maksym y Dmytro, los adolescentes que van a la guerra con solo tres días de entrenamiento
14:18 13 marzo 2022;Ucrania acusa a Rusia del secuestro de dos alcaldes en tres días
13:22 13 marzo 2022;La masiva "fuga de cerebros" que sufre Rusia por la guerra con Ucrania
11:45 13 marzo 2022;3 grandes matemáticos árabes que quizás no conoces (y sus grandes aportes a la ciencia)
11:02 13 marzo 2022;Rusia amplía su ofensiva en el oeste de Ucrania y ataca una base militar cerca de la frontera con Polonia
8:26 13 marzo 2022;¿De regreso a la URSS?: cómo la salida de compañías extranjeras de Rusia deja al país cerca de la era soviética
5:49 13 marzo 2022;Las joyas arquitectónicas que están en riesgo por la invasión rusa a Ucrania
18:17 12 marzo 2022;Arabia Saudita ejecuta a 81 hombres en un solo día
17:41 12 marzo 2022;Las fuerzas rusas intensifican sus ataques a las afueras de Kiev y se acercan a la capital ucraniana
14:57 12 marzo 2022;"The Hawks": la nueva brigada de mercenarios que están reclutando en Rusia para la guerra en Ucrania
12:25 12 marzo 2022;"Doy gracias a Dios mil veces por permitirme ser ateo": Lichtenberg, el científico que deslumbró a Goethe, Nietzsche y otros grandes pensadores
11:37 12 marzo 2022;Qué buscaba la expedición de Shackleton en el Endurance, el barco hallado en la Antártida 107 años después de su hundimiento
10:37 12 marzo 2022;"De los 10 hermanos solo quedé yo": la increíble historia de los sobrevivientes de la primera prueba de la bomba atómica
5:09 12 marzo 2022;Cómo fue el sitio de Leningrado y por qué muchos en Ucrania lo recuerdan ahora tras la invasión rusa
4:54 12 marzo 2022;Biden asegura que un enfrentamiento entre la OTAN y Rusia resultaría en la Tercera Guerra Mundial y anuncia nuevas sanciones contra Moscú
0:35 12 marzo 2022;Putin hace un llamado para que combatientes extranjeros luchen en Ucrania con las tropas rusas
22:37 11 marzo 2022;Rusia bloqueará Instagram después de que Meta anunciara que permitirá los llamados a la violencia contra Putin y las tropas rusas
21:28 11 marzo 2022;"Siria fue la escuela de guerra de Rusia para luego invadir a Ucrania"
21:05 11 marzo 2022;Cuánto depende Occidente del petróleo y el gas ruso (y qué pasa con América Latina)
19:50 11 marzo 2022;"Un genocidio en Europa central en el siglo XXI": cómo sobrevive la gente en las ciudades y pueblos capturados y asediados por Rusia
17:50 11 marzo 2022;La BBC en el frente de batalla en Járkiv con las tropas ucranianas
14:31 11 marzo 2022;Las imágenes que revelan la dimensión de la destrucción en la ciudad ucraniana de Mariúpol
11:18 11 marzo 2022;Del trigo al aluminio, 4 exportaciones estratégicas de Rusia y Ucrania
6:13 11 marzo 2022;Quién fue el autor intelectual del 11M en Madrid y otras claves que plantea el documental de Netflix sobre el mayor ataque yihadista en Europa
4:40 11 marzo 2022;"Si Járkiv cae, Ucrania cae": la BBC en el frente de batalla con las tropas ucranianas
23:40 10 marzo 2022;Los "hijos de la URSS" que ahora huyen del avance ruso en Ucrania
22:36 10 marzo 2022;¿Contratistas o mercenarios?: los peligros de la proliferación de empresas de seguridad privadas que operan en Ucrania
21:05 10 marzo 2022;"Mis amigos pueden estar enterrados en fosas comunes": la campaña de bombardeos indiscriminados sobre la ciudad de Mariúpol
18:48 10 marzo 2022;"No tengo yates, ¿de qué me voy a preocupar?": las opiniones de 3 ciudadanos rusos sobre la guerra
17:57 10 marzo 2022;Rusia prohíbe las exportaciones de algunos productos en respuesta a las sanciones de Occidente
14:16 10 marzo 2022;Burger King, KFC y otras multinacionales que siguen operando en Rusia luego de la invasión a Ucrania
12:20 10 marzo 2022;Reino Unido sanciona al multimillonario ruso Roman Abramovich, dueño del club de fútbol Chelsea
11:53 10 marzo 2022;"La acción de Putin es tan irracional que va más allá de lo que ocurrió durante la Guerra Fría"
11:51 10 marzo 2022;“Es un crimen de guerra”: el bombardeo a una maternidad y hospital infantil en Mariúpol atribuido a Rusia causa indignación internacional
11:24 10 marzo 2022;Por qué Occidente no activa una "zona de exclusión aérea" en Ucrania como pide Zelensky
10:37 10 marzo 2022;Quiénes son los oligarcas rusos sancionados por Occidente (y qué efecto pueden tener las sanciones)
4:39 10 marzo 2022;Odesa, la perla del mar Negro que fue escenario del mítico motín del acorazado Potemkin y ahora amenazan las tropas rusas
0:06 10 marzo 2022;¿Debería Rusia ser desconectada de internet tras la invasión de Ucrania?
23:20 9 marzo 2022;Por qué EE.UU. rechazó la oferta de Polonia de enviar sus aviones de combate a Ucrania
19:57 9 marzo 2022;"Corralito" en Rusia: advierten que Moscú no podrá pagar su deuda mientras los bancos dejan de cambiar rublos y limitan los retiros de divisas
17:44 9 marzo 2022;Muere el primer paciente en recibir un trasplante de corazón de cerdo
15:13 9 marzo 2022;La estrategia de la Unión Europea para dejar de depender del gas ruso
14:23 9 marzo 2022;La sorpresiva migración rusa hacia EE.UU. a través de México y su drástico aumento antes del conflicto con Ucrania
13:25 9 marzo 2022;"No tenemos miedo de protestar porque estamos juntos": cómo viven los ucranianos en las ciudades controladas por los rusos
12:12 9 marzo 2022;"Es muy peligroso, se van cinco a recoger un cadáver y esos cinco pueden morir": el testimonio de un colombiano que lleva 20 años viviendo en Ucrania
4:46 9 marzo 2022;¿Qué impacto están teniendo las armas enviadas por Occidente a Ucrania para combatir la invasión rusa?
4:34 9 marzo 2022;EE.UU. prohíbe las importaciones de petróleo, gas natural y carbón de Rusia por la invasión a Ucrania
4:24 9 marzo 2022;Maduro confirma reunión con emisarios de EE.UU. mientras la Cámara Petrolera de Venezuela dice que pueden aumentar la producción para reemplazar el crudo ruso
3:54 9 marzo 2022;Venezuela libera a dos estadounidenses tras la reunión entre Maduro y funcionarios de EE.UU.
1:09 9 marzo 2022;El niño ucraniano de 11 años que recorrió solo 1.200 km hasta llegar a Eslovaquia huyendo de la invasión rusa
23:13 8 marzo 2022;Coca-Cola, Pepsi, McDonald's y Starbucks se suman a la salida de empresas de Rusia
20:51 8 marzo 2022;Cómo se han posicionado los países de América Latina ante la invasión rusa a Ucrania
18:59 8 marzo 2022;Volodymyr Zelensky, el presidente poco convencional que se enfrenta a Putin
18:04 8 marzo 2022;Cuánto depende el mundo del petróleo y el gas de Rusia (y cuál es la situación en América Latina)
15:06 8 marzo 2022;"No hay visas hasta dentro de una semana": la frustración de los ucranianos que tratan de llegar a Reino Unido y están varados en Calais
11:36 8 marzo 2022;"Putin necesita algo para declarar victoria": cómo el liderazgo del presidente ruso está en juego con la invasión a Ucrania
10:37 8 marzo 2022;El calvario de los trabajadores atrapados en la planta nuclear de Chernóbil bajo vigilancia rusa
8:10 8 marzo 2022;Las mujeres afganas que se niegan a ser silenciadas
4:51 8 marzo 2022;De Grozni a Alepo: la brutal táctica de bombardeos con la que Rusia responde a la resistencia
23:21 7 marzo 2022;Por qué la Z se ha convertido en un símbolo de apoyo a la invasión rusa de Ucrania
22:49 7 marzo 2022;El duro relato de la familia de un policía ucraniano que denuncia que soldados rusos mataron a su mujer y sus hijos
19:27 7 marzo 2022;La huida desesperada de civiles ucranianos en medio de los ataques rusos en Irpín
18:40 7 marzo 2022;La huida desesperada de civiles ucranianos por los ataques rusos en Irpín
17:01 7 marzo 2022;“Mi tarjeta ya no funciona, pero no me quiero ir de Rusia”: la difícil situación de estudiantes latinoamericanos en Moscú tras la invasión a Ucrania
13:38 7 marzo 2022;"Es completamente inmoral": la respuesta de Ucrania a los corredores humanitarios propuestos por Moscú hacia territorio ruso
13:14 7 marzo 2022;Miles de detenidos en Rusia en protestas contra la invasión a Ucrania
12:10 7 marzo 2022;El efecto "catastrófico" de la guerra en Ucrania sobre la producción global de alimentos
10:43 7 marzo 2022;La invasión rusa en Ucrania impulsa el apoyo a la OTAN en Finlandia
